{"$schema":"http://json-schema.org/draft-07/schema#","title":"persistence_routing_trajectory","type":"object","required":["schema","arm","seed","checkpoints"],"properties":{"schema":{"const":"bindingslots_persistence/routing_trajectory/v1"},"arm":{"type":"string"},"seed":{"type":"integer"},"checkpoints":{"type":"array","items":{"type":"object"}}}}
