{
  "schema": "bindingslots_persistence/routing_trajectory/v1",
  "arm": "A+",
  "seed": 27,
  "checkpoints": [
    {
      "step": 0,
      "needle_d96": 0.0
    },
    {
      "step": 60,
      "needle_d96": 0.025
    },
    {
      "step": 120,
      "needle_d96": 0.0
    },
    {
      "step": 300,
      "needle_d96": 0.0
    },
    {
      "step": 600,
      "needle_d96": 0.008333333333333333
    },
    {
      "step": 700,
      "needle_d96": 0.008333333333333333
    },
    {
      "step": 900,
      "needle_d96": 0.0
    },
    {
      "step": 1200,
      "needle_d96": 0.0
    }
  ]
}